{
  "schema_version": "1.0",
  "env_name": "oci-vm",
  "service_overrides": {
    "keycloak": { "enabled": false },
    "default-html": { "enabled": true },
    "default-api-json": { "enabled": false },
    "globe-landing": { "enabled": false }
  },
  "routing": {
    "html_hosts": ["worldcliques.org"]
  }
}
